### ISSUE TITLE
UDP ping is used even if ICMP PING is specified in  Availability/Reachability Options./Version 1.2.12

### ISSUE THREAD

**Issue by takuro-kubota** [Cacti/cacti#3658]
# Describe the bug
Version 1.2.12
 In  Availability/Reachability Options.
UDP ping is used even if ICMP PING is specified.

## To Reproduce
1. Go to 'Create-> NewDevice
2. write
Description:1113
hostname: 1.1.1.3
SNMP Version: NotInUse
Downed Device Detection: ping
Ping Method: ICMP Ping

Click  create.

3. Confirm that there is an ICMP ping
Use tcpdump on a running machine.

[root@hostname username]# tcpdump -n -i enp2s0 host 1.1.1.3
tcpdump: verbose output suppressed, use -v or -vv for full protocol decode
listening on enp2s0, link-type EN10MB (Ethernet), capture size 262144 bytes
03:39:02.314673 IP 110.133.88.33.45379 > 1.1.1.3.telnet: UDP, length 23
03:39:02.716323 IP 110.133.88.33.45379 > 1.1.1.3.telnet: UDP, length 23
03:40:02.270100 IP 110.133.88.33.34471 > 1.1.1.3.telnet: UDP, length 23
03:40:02.671883 IP 110.133.88.33.34471 > 1.1.1.3.telnet: UDP, length 23

## Expected behavior
If you specify ICMP ping, check it with ICMP ping.

## Screenshots

![image](https://user-images.githubusercontent.com/60890984/86519035-d4438c80-be71-11ea-9359-24e0707b2877.png)

## Desktop (please complete the following information)

* Cacti running server
   Linux shuttle 3.10.0-1127.13.1.el7.x86_64 #1 SMP Tue Jun 23 15:46:38 UTC 2020 x86_64 x86_64 x86_64 GNU/Linux
* cliant pc
   windows10

 chrome

Version 1.2.12

**Comment by bmfmancini** [comment]
Are you using spine ?

If so make sure that the set uid is set proper because if it's not spine
will fail back to udp ping regardless of availability setting

**Comment by bmfmancini** [comment]
You would also see this in the log saying something like spine failing back
to udp ping due to setuid issues

**Comment by takuro-kubota** [comment]
THK 

 chmod u+s  /usr/bin/spine
done.

![image](https://user-images.githubusercontent.com/60890984/86519803-6602c800-be79-11ea-940c-a65bfe9e199b.png)

**Comment by netniV** [comment]
Yeah, that warning occurs because SetUID is either incorrect or the ability to do it is disabled.  As it is unable to switch to root (spine must also be owned by root) then it can't perform ICMP pings because that requires raw sockets and therefore root privileges.

Sometimes, people find that they aren't actually running the version of spine they've performed SetUID on as well due to the paths they've setup in the settings.
