### ISSUE TITLE
Autom8 - empty snmp sysName not listed in discovered hosts

### ISSUE THREAD

**Issue by choefing** [Cacti/cacti#653]
Hi gents,

in case during network discovery both icmp AND snmp succeed but snmpd does not have "sysName" populated on target device, the device is not put onto the "discovered hosts" list.

I figured out finally with tcpdump that network is properly working.

NOT working example:
> 09:34:59.791965 IP cacti > 10.128.63.1: ICMP echo request, id 9489, seq 1, length 64
> 09:34:59.793356 IP 10.128.63.1 > cacti: ICMP echo reply, id 9489, seq 1, length 64
> 09:34:59.794704 IP cacti.57308 > 10.128.63.1.snmp:  GetRequest(28)  system.sysObjectID.0
> 09:34:59.796085 IP 10.128.63.1.snmp > cacti.57308:  GetResponse(41)  system.sysObjectID.0=E:303.3.3.12.1.1.18
> 09:34:59.796522 IP cacti.35923 > 10.128.63.1.snmp:  GetRequest(28)  system.sysName.0
> **09:34:59.798111 IP 10.128.63.1.snmp > cacti.35923:  GetResponse(28)  system.sysName.0=""**

working example:
> 09:38:13.657762 IP cacti > 10.128.63.2: ICMP echo request, id 9649, seq 1, length 64
> 09:38:13.659944 IP 10.128.63.2 > cacti: ICMP echo reply, id 9649, seq 1, length 64
> 09:38:13.661338 IP cacti.49768 > 10.128.63.2.snmp:  GetRequest(28)  system.sysObjectID.0
> 09:38:13.662711 IP 10.128.63.2.snmp > cacti.49768:  GetResponse(41)  system.sysObjectID.0=E:303.3.3.12.1.1.43
> 09:38:13.663136 IP cacti.37205 > 10.128.63.2.snmp:  GetRequest(28)  system.sysName.0
> **09:38:13.664666 IP 10.128.63.2.snmp > cacti.37205:  GetResponse(39)  system.sysName.0="somehostname"**

Of course this field should be populated properly but.. theory != reality as we all might know ;)
It might be an idea to populate the "discovered host" list with either IP address or maybe allow "empty" entries.

Still appreciate your work on this over the past years and hopefully in the future.
Thanks

Chris

**Comment by cigamit** [comment]
I'd say this is a bug.  Will try to get this one addressed before the 1.1.6 release tomorrow night.

**Comment by cigamit** [comment]
Resolved.
