### ISSUE TITLE
Cacti still polls sysUpTimeInstance when re-index method is 'None'

### ISSUE THREAD

**Issue by eschoeller** [Cacti/cacti#468]
Sorry in advance, I'm not sure if this is a real issue or I'm submitting a support inquiry ... 

I am trying to use the Re-Index method "None" on several data queries but they appear to still be re-caching the system uptime object on every poller run:

mysql> select * from host_snmp_query;
+---------+---------------+------------+-----------------+----------------+
| host_id | snmp_query_id | sort_field | title_format    | reindex_method |
+---------+---------------+------------+-----------------+----------------+
|      10 |             1 | ifDescr    | |query_ifDescr| |              1 |
|     187 |            55 | index      | |query_index|   |              0 |
|     187 |            56 | index      | |query_index|   |              0 |
|     187 |            57 | index      | |query_index|   |              0 |
|     187 |            58 | index      | |query_index|   |              0 |
|     187 |            59 | index      | |query_index|   |              0 |
|     187 |            60 | Index      | |query_Index|   |              0 |
|     187 |            61 | Index      | |query_Index|   |              0 |
|     187 |            62 |            | |query_|        |              0 |
|     187 |            63 |            | |query_|        |              0 |
|     187 |            64 | Index      | |query_Index|   |              0 |
+---------+---------------+------------+-----------------+----------------+
11 rows in set (0.00 sec)

2017-03-22 19:24:46 - SPINE: Poller[1] Device[187] TH[3] Recache DataQuery[55] OID: .1.3.6.1.2.1.1.3.0, output: 387523692
2017-03-22 19:24:46 - SPINE: Poller[1] Device[187] TH[3] Recache DataQuery[56] OID: .1.3.6.1.2.1.1.3.0, output: 387523692
2017-03-22 19:24:46 - SPINE: Poller[1] Device[187] TH[3] Recache DataQuery[57] OID: .1.3.6.1.2.1.1.3.0, output: 387523692
2017-03-22 19:24:46 - SPINE: Poller[1] Device[187] TH[3] Recache DataQuery[58] OID: .1.3.6.1.2.1.1.3.0, output: 387523692
2017-03-22 19:24:46 - SPINE: Poller[1] Device[187] TH[3] Recache DataQuery[60] OID: .1.3.6.1.2.1.1.3.0, output: 387523692
2017-03-22 19:24:46 - SPINE: Poller[1] Device[187] TH[3] Recache DataQuery[61] OID: .1.3.6.1.2.1.1.3.0, output: 387523692
2017-03-22 19:24:46 - SPINE: Poller[1] Device[187] TH[3] Recache DataQuery[62] OID: .1.3.6.1.2.1.1.3.0, output: 387523692
2017-03-22 19:24:46 - SPINE: Poller[1] Device[187] TH[3] Recache DataQuery[63] OID: .1.3.6.1.2.1.1.3.0, output: 387523692
2017-03-22 19:24:46 - SPINE: Poller[1] Device[187] TH[3] Recache DataQuery[64] OID: .1.3.6.1.2.1.1.3.0, output: 387523692
2017-03-22 19:24:46 - SPINE: Poller[1] Device[187] TH[2] Recache DataQuery[55] OID: .1.3.6.1.2.1.1.3.0, output: 387523692
2017-03-22 19:24:46 - SPINE: Poller[1] Device[187] TH[2] Recache DataQuery[56] OID: .1.3.6.1.2.1.1.3.0, output: 387523692
2017-03-22 19:24:46 - SPINE: Poller[1] Device[187] TH[2] Recache DataQuery[57] OID: .1.3.6.1.2.1.1.3.0, output: 387523692
2017-03-22 19:24:46 - SPINE: Poller[1] Device[187] TH[2] Recache DataQuery[58] OID: .1.3.6.1.2.1.1.3.0, output: 387523692
2017-03-22 19:24:46 - SPINE: Poller[1] Device[187] TH[2] Recache DataQuery[60] OID: .1.3.6.1.2.1.1.3.0, output: 387523692
2017-03-22 19:24:46 - SPINE: Poller[1] Device[187] TH[2] Recache DataQuery[61] OID: .1.3.6.1.2.1.1.3.0, output: 387523692
2017-03-22 19:24:46 - SPINE: Poller[1] Device[187] TH[2] Recache DataQuery[62] OID: .1.3.6.1.2.1.1.3.0, output: 387523692
2017-03-22 19:24:46 - SPINE: Poller[1] Device[187] TH[2] Recache DataQuery[63] OID: .1.3.6.1.2.1.1.3.0, output: 387523692
2017-03-22 19:24:46 - SPINE: Poller[1] Device[187] TH[2] Recache DataQuery[64] OID: .1.3.6.1.2.1.1.3.0, output: 387523692
2017-03-22 19:24:46 - SPINE: Poller[1] Device[187] TH[6] Recache DataQuery[55] OID: .1.3.6.1.2.1.1.3.0, output: 387523692
2017-03-22 19:24:46 - SPINE: Poller[1] Device[187] TH[6] Recache DataQuery[56] OID: .1.3.6.1.2.1.1.3.0, output: 387523692
2017-03-22 19:24:46 - SPINE: Poller[1] Device[187] TH[6] Recache DataQuery[57] OID: .1.3.6.1.2.1.1.3.0, output: 387523692
2017-03-22 19:24:46 - SPINE: Poller[1] Device[187] TH[6] Recache DataQuery[58] OID: .1.3.6.1.2.1.1.3.0, output: 387523692
2017-03-22 19:24:46 - SPINE: Poller[1] Device[187] TH[6] Recache DataQuery[60] OID: .1.3.6.1.2.1.1.3.0, output: 387523692
2017-03-22 19:24:46 - SPINE: Poller[1] Device[187] TH[6] Recache DataQuery[61] OID: .1.3.6.1.2.1.1.3.0, output: 387523692
2017-03-22 19:24:46 - SPINE: Poller[1] Device[187] TH[6] Recache DataQuery[62] OID: .1.3.6.1.2.1.1.3.0, output: 387523692
2017-03-22 19:24:46 - SPINE: Poller[1] Device[187] TH[6] Recache DataQuery[63] OID: .1.3.6.1.2.1.1.3.0, output: 387523692
2017-03-22 19:24:46 - SPINE: Poller[1] Device[187] TH[6] Recache DataQuery[64] OID: .1.3.6.1.2.1.1.3.0, output: 387523692
2017-03-22 19:24:46 - SPINE: Poller[1] Device[187] TH[5] Recache DataQuery[55] OID: .1.3.6.1.2.1.1.3.0, output: 387523692
2017-03-22 19:24:46 - SPINE: Poller[1] Device[187] TH[5] Recache DataQuery[56] OID: .1.3.6.1.2.1.1.3.0, output: 387523692
2017-03-22 19:24:46 - SPINE: Poller[1] Device[187] TH[5] Recache DataQuery[57] OID: .1.3.6.1.2.1.1.3.0, output: 387523692
2017-03-22 19:24:46 - SPINE: Poller[1] Device[187] TH[5] Recache DataQuery[58] OID: .1.3.6.1.2.1.1.3.0, output: 387523692
2017-03-22 19:24:46 - SPINE: Poller[1] Device[187] TH[5] Recache DataQuery[60] OID: .1.3.6.1.2.1.1.3.0, output: 387523692
2017-03-22 19:24:46 - SPINE: Poller[1] Device[187] TH[5] Recache DataQuery[61] OID: .1.3.6.1.2.1.1.3.0, output: 387523692
2017-03-22 19:24:46 - SPINE: Poller[1] Device[187] TH[5] Recache DataQuery[62] OID: .1.3.6.1.2.1.1.3.0, output: 387523692
2017-03-22 19:24:46 - SPINE: Poller[1] Device[187] TH[5] Recache DataQuery[63] OID: .1.3.6.1.2.1.1.3.0, output: 387523692
2017-03-22 19:24:46 - SPINE: Poller[1] Device[187] TH[5] Recache DataQuery[64] OID: .1.3.6.1.2.1.1.3.0, output: 387523692
2017-03-22 19:24:46 - SPINE: Poller[1] Device[187] TH[4] Recache DataQuery[55] OID: .1.3.6.1.2.1.1.3.0, output: 387523693
2017-03-22 19:24:46 - SPINE: Poller[1] Device[187] TH[4] Recache DataQuery[56] OID: .1.3.6.1.2.1.1.3.0, output: 387523693
2017-03-22 19:24:46 - SPINE: Poller[1] Device[187] TH[4] Recache DataQuery[57] OID: .1.3.6.1.2.1.1.3.0, output: 387523693
2017-03-22 19:24:46 - SPINE: Poller[1] Device[187] TH[4] Recache DataQuery[58] OID: .1.3.6.1.2.1.1.3.0, output: 387523693
2017-03-22 19:24:46 - SPINE: Poller[1] Device[187] TH[4] Recache DataQuery[60] OID: .1.3.6.1.2.1.1.3.0, output: 387523693
2017-03-22 19:24:46 - SPINE: Poller[1] Device[187] TH[4] Recache DataQuery[61] OID: .1.3.6.1.2.1.1.3.0, output: 387523693
2017-03-22 19:24:46 - SPINE: Poller[1] Device[187] TH[4] Recache DataQuery[62] OID: .1.3.6.1.2.1.1.3.0, output: 387523693
2017-03-22 19:24:46 - SPINE: Poller[1] Device[187] TH[4] Recache DataQuery[63] OID: .1.3.6.1.2.1.1.3.0, output: 387523693
2017-03-22 19:24:46 - SPINE: Poller[1] Device[187] TH[4] Recache DataQuery[64] OID: .1.3.6.1.2.1.1.3.0, output: 387523693
2017-03-22 19:24:46 - SPINE: Poller[1] Device[187] TH[1] Recache DataQuery[55] OID: .1.3.6.1.2.1.1.3.0, output: 387523697
2017-03-22 19:24:46 - SPINE: Poller[1] Device[187] TH[1] Recache DataQuery[56] OID: .1.3.6.1.2.1.1.3.0, output: 387523697
2017-03-22 19:24:46 - SPINE: Poller[1] Device[187] TH[1] Recache DataQuery[57] OID: .1.3.6.1.2.1.1.3.0, output: 387523697
2017-03-22 19:24:46 - SPINE: Poller[1] Device[187] TH[1] Recache DataQuery[58] OID: .1.3.6.1.2.1.1.3.0, output: 387523697
2017-03-22 19:24:46 - SPINE: Poller[1] Device[187] TH[1] Recache DataQuery[60] OID: .1.3.6.1.2.1.1.3.0, output: 387523697
2017-03-22 19:24:46 - SPINE: Poller[1] Device[187] TH[1] Recache DataQuery[61] OID: .1.3.6.1.2.1.1.3.0, output: 387523697
2017-03-22 19:24:46 - SPINE: Poller[1] Device[187] TH[1] Recache DataQuery[62] OID: .1.3.6.1.2.1.1.3.0, output: 387523697
2017-03-22 19:24:46 - SPINE: Poller[1] Device[187] TH[1] Recache DataQuery[63] OID: .1.3.6.1.2.1.1.3.0, output: 387523697
2017-03-22 19:24:46 - SPINE: Poller[1] Device[187] TH[1] Recache DataQuery[64] OID: .1.3.6.1.2.1.1.3.0, output: 387523697

19:29:47.140992 IP 192.168.0.1.57248 > 192.168.0.2.snmp:  GetRequest(28)  .1.3.6.1.2.1.1.3.0
19:29:47.140995 IP 192.168.0.1.55329 > 192.168.0.2.snmp:  GetRequest(28)  .1.3.6.1.2.1.1.3.0
19:29:47.141223 IP 192.168.0.1.57427 > 192.168.0.2.snmp:  GetRequest(28)  .1.3.6.1.2.1.1.3.0
19:29:47.141748 IP 192.168.0.1.55843 > 192.168.0.2.snmp:  GetRequest(28)  .1.3.6.1.2.1.1.3.0                                                                                                                                                 
19:29:47.142198 IP 192.168.0.1.59206 > 192.168.0.2.snmp:  GetRequest(28)  .1.3.6.1.2.1.1.3.0                                                                                                                                                 
19:29:47.142321 IP 192.168.0.1.44914 > 192.168.0.2.snmp:  GetRequest(28)  .1.3.6.1.2.1.1.3.0                                                                                                                                                 
19:29:47.177599 IP 192.168.0.1.57248 > 192.168.0.2.snmp:  GetRequest(28)  .1.3.6.1.2.1.1.3.0                                                                                                                                                 
19:29:47.180827 IP 192.168.0.1.57427 > 192.168.0.2.snmp:  GetRequest(28)  .1.3.6.1.2.1.1.3.0                                                                                                                                                 
19:29:47.184480 IP 192.168.0.1.55843 > 192.168.0.2.snmp:  GetRequest(28)  .1.3.6.1.2.1.1.3.0                                                                                                                                                 
19:29:47.187890 IP 192.168.0.1.59206 > 192.168.0.2.snmp:  GetRequest(28)  .1.3.6.1.2.1.1.3.0

I'm trying to cut back on how much SNMP traffic is hitting these type of devices, and also improve system performance by reducing the overhead of this data query. I can't seem to get Cacti to stop polling the sysUpTimeInstance object, it shouldn't be needed if the re-index method is set to None.

**Comment by cigamit** [comment]
Wrong target.  'SELECT * FROM poller_reindex'.  That's the problem doing it by hand.  I know we had a feature at one time.  You should open a new request requesting to change the re-index method without dropping the Data Query and re-adding it.

**Comment by eschoeller** [comment]
OK, I see so the data query should not have an entry at all in poller_reindex if the reindex method is set to None. Cool. I will open another feature request. thanks
