### ISSUE TITLE
Cacti does not poll device if device is pingable but Get request for system.sysUptime.0 fails.

### ISSUE THREAD

**Issue by chrisrogerson** [Cacti/cacti#5551]
# Describe the bug

Some devices do not respond to system oids. To allow Cacti to continue to poll them for more specific OIDs, Downed Device Detection could be set to "Ping" or "Ping or SNMP Uptime". The device I have shows as up with these settings in place, but the poller does not perform the queries for the data sources attached to the device.

## To Reproduce

1. Configure a device that can be SNMP polled for anything but the system OIDs.
2. Configure device in Cacti server with  Downed Device Detection set to "Ping" or "Ping or SNMP Uptime"
3. Create graphs and RRDs for the device.
4. Watch as graphs state that "whatever.rrd does not exist. It is possible that the poller has not yet run." for multiple polling cycles.

5. Enable system oids.
6. Watch graphs appear at next cycle.

## Expected behavior

If Downed Device Detection is set to "Ping" or "Ping or SNMP Uptime" and the device is Up, the poller should run normally for the device.
The graphs that I was able to narrow this down on were working before upgrade from Ubuntu 22.10 and Cacti 1.2.19.

## Server:
VMWare ESXi
OS:Ubuntu 23.10
Cacti: 1.2.25 installed as cacti-spine from Ubuntu default repositories

**Comment by TheWitness** [comment]
Use one of the other ping methods.

**Comment by chrisrogerson** [comment]
Can you elaborate on this?

How would changing the ping method resolve this software regression?

**Comment by TheWitness** [comment]
There is a ping method called "SNMP GetNext", that's a pretty generic one.  However, if it's a Cacti snmp device, it will want to collect this System OID's, which if your hardware does not support them, we will need more information.

**Comment by chrisrogerson** [comment]
My application is an Incognito BCC server. snmpd was not enabled at the OS level. The BCC application has an internal SNMP agent that is polled for the dhcp statistics. (I use templates from https://forums.cacti.net/viewtopic.php?t=52895). The server responds to ICMP ping, allowing Cacti to register the device in an Up status. Re-indexing the server and reloading the data query work fine. For whatever reason, with the Down Device Detection set to "Ping" I can see the an SNMP uptime request being sent to the server via tcpdumps and no further SNMP polls during polling cycles.

I made a change to my servers to allow my graphs to start working again, so this no longer affects me. (Agent X integration into the OS snmpd process). I did figure that the Cacti group would be interested in this clear software regression though.

I do have a lab server that I am happy to use for any testing that you may need me to perform.

**Comment by TheWitness** [comment]
So, cacti, since 1.x polls for the snmp system mib periodically which includes quite a bit of info, and every agent 'should' include it.

Walk the entire tree starting with .1.3.6 and send across the first 15 or so lines.

**Comment by TheWitness** [comment]
Also, what is the reindex method for the data queries?

**Comment by chrisrogerson** [comment]
snmpwalk -v2c -c community BCC-LAB .1.3.6
SNMPv2-MIB::snmpInPkts.0 = Counter32: 1
SNMPv2-MIB::snmpOutPkts.0 = Counter32: 1
SNMPv2-MIB::snmpInBadVersions.0 = Counter32: 0
SNMPv2-MIB::snmpInBadCommunityNames.0 = Counter32: 0
SNMPv2-MIB::snmpInBadCommunityUses.0 = Counter32: 0
SNMPv2-MIB::snmpInASNParseErrs.0 = Counter32: 0
SNMPv2-MIB::snmpInTooBigs.0 = Counter32: 0
SNMPv2-MIB::snmpInNoSuchNames.0 = Counter32: 0
SNMPv2-MIB::snmpInBadValues.0 = Counter32: 0
SNMPv2-MIB::snmpInReadOnlys.0 = Counter32: 0
SNMPv2-MIB::snmpInGenErrs.0 = Counter32: 0
SNMPv2-MIB::snmpInTotalReqVars.0 = Counter32: 11
SNMPv2-MIB::snmpInTotalSetVars.0 = Counter32: 0
SNMPv2-MIB::snmpInGetRequests.0 = Counter32: 0
SNMPv2-MIB::snmpInGetNexts.0 = Counter32: 14
SNMPv2-MIB::snmpInSetRequests.0 = Counter32: 0
SNMPv2-MIB::snmpInGetResponses.0 = Counter32: 0
SNMPv2-MIB::snmpInTraps.0 = Counter32: 0
SNMPv2-MIB::snmpOutTooBigs.0 = Counter32: 0
SNMPv2-MIB::snmpOutNoSuchNames.0 = Counter32: 0
SNMPv2-MIB::snmpOutBadValues.0 = Counter32: 0
SNMPv2-MIB::snmpOutGenErrs.0 = Counter32: 0
SNMPv2-MIB::snmpOutGetRequests.0 = Counter32: 0
SNMPv2-MIB::snmpOutGetNexts.0 = Counter32: 0
SNMPv2-MIB::snmpOutSetRequests.0 = Counter32: 0
SNMPv2-MIB::snmpOutGetResponses.0 = Counter32: 25
SNMPv2-MIB::snmpOutTraps.0 = Counter32: 0
SNMPv2-MIB::snmpEnableAuthenTraps.0 = INTEGER: disabled(2)
SNMPv2-MIB::snmpSilentDrops.0 = Counter32: 0
SNMPv2-MIB::snmpProxyDrops.0 = Counter32: 0
SNMPv2-SMI::enterprises.3493.2.33.1.3.1.1.1.1.1.10.0.0.5 = IpAddress: 10.0.0.5

The reindex method was set to uptime.

**Comment by TheWitness** [comment]
Okay, you might be able to get out of this by keeping the ping method ping (tcp|icmp|udp), and switching the Re-index method to None or Verify All Fields.  If you manually re-index periodically, I would suggest 'None'.  The re-index method is getting you into this issue.

It's too bad that the agent does not provide the system mib.  Would be better as an agent extension to the standard MIB instead of a standalone agent.

**Comment by chrisrogerson** [comment]
I attempted to use "Ping" for Down Device Detection with "ICMP" and "UDP" Ping Methods in combination with all reindex methods yesterday after seeing your request for the chosen update method.

This is an example run of the poller after changing to "Ping" for Down Device Detection with "ICMP" Ping Method in combination with "None" for reindex method:
16:45:19.451775 IP cacti > BCC-LAB: ICMP echo request, id 15820, seq 44545, length 31
16:45:19.486221 IP BCC-LAB > cacti: ICMP echo reply, id 15820, seq 44545, length 31
16:45:19.487032 IP cacti.53841 > BCC-LAB.161:  GetRequest(28)  system.sysUpTime.0
16:45:19.522046 IP BCC-LAB.161 > cacti.53841:  GetResponse(28)  system.sysUpTime.0=[noSuchObject]

As you can see, the system.UpTime MIB is still requested, the request fails, and the poller moves on without polling any of the MIBs for the datasources.

I did not have OS level access to these servers when they were initially deployed and had to use the application's built in SNMP agent at the time. I have now reconfigured them to use AgentX integrated with the OS, solving this for me at least.

**Comment by TheWitness** [comment]
Likely the right way to go for the near term.
