### ISSUE TITLE
Allow non-standard Remote Agent port to be used

### ISSUE THREAD

**Issue by 212850a** [Cacti/cacti#3845]
I'm using cacti 1.2.10 with rhel 7.8 in configuration with mainpoller and one remotepoller, apache uses http on non default port 5985, so cacti is accessible as http://mainpoller:5985/cacti (or http://remotepoller:5985/cacti on remote poller).
There is no issues with connectivity between main and remote collectors if I check it via Data Collection -> Data Collectors and full sync works just fine.

However if I have some snmp devices which are linked with remote collector (as poller association) I'm not able to run Reload Query on them (if I'm logged in to mainpoller web interface) - it works only if I logged to remotepoller web interface directly.
And if I try to open device which is associated with remotepoller from mainpoller web interface i get "ERROR: Failed to connect to remote collector" for SNMP Information on top of device setting.

Mainpoller and remote one are in the same network - no NAT, I don't see any SELinux error on both servers either.
The thing which is worrying me - if on mainpoller I try to open device which is collected by remote poller I get "ERROR: Failed to connect to remote collector" but at the same time I don't see anything in apache log on remote collector.
Looks like mainpoller does not try to connect to remotepoller's apache, but it should! 
Is it the problem of non standard port (5985) which we use?

1. On Main poller go to Devices
2. Select Data Collector any which is not main one
3. Open any of device (which is collected by remote collector)
4. Get error "ERROR: Failed to connect to remote collector"

**Comment by 212850a** [comment]
I also tried to upgrade test environment to 1.2.14 - the same behaviour - "ERROR: Failed to connect to remote collector".
In the past I used 1.1.38 with https on tcp/443 port and everything worked just fine. 
Is it really problem of non-standard port?

**Comment by 212850a** [comment]
I've just enabled tcpdump on mainpoller server and opened device (via mainpoller web interface) which is collected by remotepoller. 
From the below tcpdump it's visible that everything starts on 5985 port which is correct, but then request is sent to port 80 (which nothing is listening):
17:28:56.390411 IP 10.0.2.2.54025 > 10.0.2.15.**5985**: Flags [P.], seq 1999:2439, ack 114598, win 65535, length 440: HTTP: GET /cacti/host.php?action=ping_host&id=2 HTTP/1.1
17:28:56.390434 IP 10.0.2.15.**5985** > 10.0.2.2.54025: Flags [.], ack 2439, win 34782, length 0
17:28:56.446877 IP 192.168.8.1.45622 > 192.168.8.2.**80**: Flags [S], seq 583668797, win 29200, options [mss 1460,sackOK,TS val 22493364 ecr 0,nop,wscale 7], length 0
17:28:56.447145 IP 192.168.8.2.**80** > 192.168.8.1.45622: Flags [R.], seq 0, ack 583668798, win 0, length 0
17:28:56.450024 IP 10.0.2.15.**5985** > 10.0.2.2.54025: Flags [P.], seq 114598:115298, ack 2439, win 34782, length 700: HTTP: HTTP/1.1 200 OK
17:28:56.450183 IP 10.0.2.2.54025 > 10.0.2.15.**5985**: Flags [.], ack 115298, win 65535, length 0

I believe it's bug and it should be fixed. 
Otherwise I'm not aware about configuration which I have to apply to fix it.

**Comment by netniV** [comment]
This is more a feature request.  Currently, we do not support sites on custom ports.  HTTP connections are expected to be on port 80 and SSL connections are expected to be on port 443.  Even if you attempted to set the hostname of a poller to include the port using the colon syntax, eg. my.hostname.net:456 the field would get updated to be my.hostname.net and stop working.

**Comment by 212850a** [comment]
> This is more a feature request. Currently, we do not support sites on custom ports. HTTP connections are expected to be on port 80 and SSL connections are expected to be on port 443. Even if you attempted to set the hostname of a poller to include the port using the colon syntax, eg. my.hostname.net:456 the field would get updated to be my.hostname.net and stop working.

Thanks for reply, Mark.
What workaround you would suggest if we have to use ports non-standard port for apache (we don't have root)?

**Comment by TheWitness** [comment]
Yea, this is a good idea.  Glad you are requesting it.

**Comment by netniV** [comment]
You can try setting the hostname to something like hostname:6966 but I really suspect that it will change back.  If it doesn't and it works for everything I would be really surprised.

**Comment by 212850a** [comment]
> You can try setting the hostname to something like hostname:6966 but I really suspect that it will change back. If it doesn't and it works for everything I would be really surprised.

Already tried. It does not work.

**Comment by TheWitness** [comment]
It's due to the context call.  Let me propose a patch.  Not awake yet though.

**Comment by TheWitness** [comment]
What errors do you get when you augment the port?  Is it a save failure?  We could add the port, but we also use that hostname for MySQL connection interrogation.  We would need to add an http port option to the table I think.

**Comment by TheWitness** [comment]
So, I've committed a patch to 1.3.  You may choose to backport it.  @netniV will access the risk and make a determination on incorporating in 1.2.15.

**Comment by TheWitness** [comment]
Console > Configuration > Settings > General

![image](https://user-images.githubusercontent.com/1439914/95661390-f9910800-0afc-11eb-99f4-206034348112.png)
